[
  {
    "id": "gt-choix",
    "titre": "Le choix de la question",
    "devantJury": true,
    "resume": "En arrivant, tu remets au jury tes deux questions, sur une feuille signée par tes professeurs de spécialité et tamponnée par le lycée. Le jury en choisit une.",
    "order": 0,
    "sources": ["s-grand-oral"]
  },
  {
    "id": "gt-preparation",
    "titre": "La préparation",
    "minutes": 20,
    "devantJury": false,
    "resume": "Tu mets tes idées en ordre sur la question choisie et, si tu le souhaites, tu prépares un support pour ton exposé. Ce support n'est pas évalué.",
    "order": 1,
    "sources": ["s-grand-oral"]
  },
  {
    "id": "gt-expose",
    "titre": "L'exposé",
    "minutes": 10,
    "devantJury": true,
    "resume": "Debout, sauf aménagement (une adaptation prévue pour les candidats à besoins spécifiques). Tu expliques d'abord pourquoi tu as choisi de préparer cette question, puis tu la développes et tu y réponds. Le jury évalue ton argumentation et tes qualités d'orateur.",
    "order": 2,
    "sources": ["s-grand-oral"]
  },
  {
    "id": "gt-echange",
    "titre": "L'échange avec le jury",
    "minutes": 10,
    "devantJury": true,
    "resume": "Assis ou debout, au choix. Le jury t'interroge pour te faire préciser et approfondir ta pensée ; il peut t'interroger sur toute partie du programme de tes spécialités (première et terminale), en lien avec ton exposé. Il évalue la solidité de tes connaissances et ton argumentation.",
    "order": 3,
    "sources": ["s-grand-oral"]
  }
]
